email,label
I’m grateful for the trust you’ve placed in our team.,0
I’ll keep you updated on any new developments.,0
FreeMsg:Feelin kinda lnly hope u like 2 keep me company! Jst got a cam moby wanna c my pic?Txt or reply DATE to 82242 Msg150p 2rcv Hlp 08712317606 stop to 82242,1
Bloomberg -Message center +447797706009 Why wait? Apply for your future http://careers. bloomberg.com,1
"URGENT. Important information for 02 user. Today is your lucky day! 2 find out why , log onto http://www.urawinner.com there is a fantastic surprise awaiting you !",1
usedto one development ticket wife welcome considered miserable added opened handwriting slow fascinate captain action miserable certified onlinepharmacy all countries shipping viagraas low as cialisas low as valiumas low as cialissofttabsas low as xanaxas low as plus meds more viagrasofttabsas low as ambienas low as meridiaas low as somaas low as tramadolas low as plus meds more best price buy now click here ground ran surprise telling satisfaction wonder garden nothing went son mentioned human handwriting pleasure servants nothing,1
U buy newspapers already?,0
URGENT! Your Mobile number has been awarded with a å£2000 prize GUARANTEED. Call 09058094454 from land line. Claim 3030. Valid 12hrs only,1
I appreciate your responsiveness and attention to detail.,0
Monthly password for wap. mobsi.com is 391784. Use your wap phone not PC.,1
Download our free report on wealth-building strategies.,1
"Had your contract mobile 11 Mnths? Latest Motorola, Nokia etc. all FREE! Double Mins & Text on Orange tariffs. TEXT YES for callback, no to remove from records",1
"cmon babe, make me horny, *turn* me on! Txt me your fantasy now babe -) Im hot, sticky and need you now. All replies cost å£1.50. 2 cancel send STOP",1
well make work thanks sj original message mcgowan mike w sent thursday october pm january steven subject sla settlement steve believe everyone available ok vs mike original message january steven sent thursday october pm mcgowan mike w blair lynn cc kirk steve subject sla settlement mike talked lynn wednesday would work us thanks sj original message mcgowan mike w sent wednesday october pm january steven blair lynn cc kirk steve subject sla settlement aware nng reached settlement shippers sla proceeding part settlement provides nng shippers work together good faith develop imbalance resolution includes shipper option kind balancing cash also working group would define parameters around nng could buy sell gas operational storage account mary kay asked steve kirk co chair committee nng two also members committee behalf nng assume ok assignment would like get together discuss general approach effort steve think initial meeting could held video conference room could let know availability get together sometime next week appr hours try coordinate meeting group probably include mary kay possibly dave neubauer let know thanks mike mcgowan,0
Receive exclusive access to our VIP members-only sale.,1
nacional loterias sp calle aberto escapenumbera madrid branch spain reference numbers sp e mail address lottery wish congratulate success computer balloting sweepstake held escapenumberth may millennium scientific computer game email addresses used promotional program aimed encouraging internet users therefore need buy ticket enter email address attached ticket number drew lucky star numbers consequently draw second category approve star prize one million one hundred thousand euros escapenumberm euros congratulations advised keep winning confidential receive lump prize account protective measure avoid double claiming people may tell send winning ticket numbers reference numbers amount personal data processing claim emails infowining lawyer com nacionalloteria netscape net name sanchez fernandez tel address avenida de america madrid spain prizes must claimed within three weeks note age automatically disqualified star prize faithfully mrs eva carlos cc nacionalloteria netscape net,1
Get a free trial of our premium membership.,1
I’m forwarding this message to the relevant department for review.,0
Sunshine Quiz Wkly Q! Win a top Sony DVD player if u know which country Liverpool played in mid week? Txt ansr to 82277. å£1.50 SP:Tyrone,1
I’ll be traveling next week but reachable via email.,0
"Hottest pics straight to your phone!! See me getting Wet and Wanting, just for you xx Text PICS to 89555 now! txt costs 150p textoperator g696ga 18 XxX",1
Todays Voda numbers ending 7548 are selected to receive a $350 award. If you have a match please call 08712300220 quoting claim code 4041 standard rates app,1
my as several hot thursday mistress bird walk directly careful apology responsible wall master awful ladies wide,1
We tried to contact you re our offer of New Video Phone 750 anytime any network mins HALF PRICE Rental camcorder call 08000930705 or reply for delivery Wed,1
Santa calling! Would your little ones like a call from Santa Xmas Eve? Call 09077818151 to book you time. Calls1.50ppm last 3mins 30s T&C www.santacalling.com,1
subject service update due significant rapid policy changes recently implemented many major search engines updated publication may evaluate site exposure new risks opportunities http www sitestrategies98 com unsubscribe please click link enter email address http www sitestrategies98 com unsubscribe html,1
Still i have not checked it da. . .,0
Get a complimentary workout plan from a top trainer.,1
Can Ì_ call me at 10:10 to make sure dat i've woken up...,0
Never y lei... I v lazy... Got wat? Dat day Ì_ send me da url cant work one...,0
I wish things were different. I wonder when i will be able to show you how much i value you. Pls continue the brisk walks no drugs without askin me please and find things to laugh about. I love you dearly.,0
Just checking in to see if you had any updates.,0
Get early access to our flash sales before they go public!,1
I’ve copied our team lead for visibility.,0
Congratulations! You’re pre-approved for a personal loan.,1
I’m happy to provide additional context if needed.,0
Claim your special invitation to our exclusive online event.,1
Am not interested to do like that.,0
Claim a special offer for first-time users of our service.,1
Jus finish blowing my hair. U finish dinner already?,0
Unlock a surprise reward for signing up for our newsletter.,1
Please let me know if there’s anything else I should include.,0
Please let me know if there’s anything I can do to help.,0
Please review the attached document when you have a chance.,0
hi errol message confirm meeting wednesday november escapenumberth pm escapenumberpm location eb attendees monica brown sheri righi let us know question reached thanks monica l brown accenture houston allen parkway direct dial vpn octel fax email monica l brown accenture message designated recipient may contain privileged proprietary otherwise private information received error please notify sender immediately delete original use email prohibited,0
hello our congratulations to you you have been selected as a finalist in the nvp travel giveaway prizes are accommodations for two for two nights at any one of the following locations ft lauderdale or daytona fl williamsburg va orlando fl las vegas nv bahamas branson mo all you have to do is complete the finalists' registration form be sure to include your confirmation number g as an added bonus the first finalists to register will receive a free entry in one of our bonus drawings for cash or plane tickets for adults to any continental u s destination why wait you could be on your way click here to travel today lisa davidson national vacation promotions your screen name was entered in our giveaway if you do not wish to participate in future promotions please click here free mortgage quotes save,1
i want to thank each of you for the role you played in maintaining operations and customer communications during the internet outages we have experienced this week having knowledgeable and dedicated staff to answer customer calls is always important especially during periods of internet and email outages our customer teams and the hottap helpdesk talked many customers through the process of using the offsite server and even manually entered nominations for customers our gas control staff continued to effectively operate our systems despite having to handle an increased volume of calls from customers and while working in an environment without many of the normal reports the events of last week and this week added to an already long list of operational and systems challenges that we have faced this summer it has been a long and exhausting summer for our entire ets logistics team and for our system support staff and with a move ahead for much of our team i realize that there are still added demands on everyone's plate as i salute all your efforts to date and your patience in the move ahead i need to make a few additional requests of you please refrain from any non essential internet use as our team is connected back to internet access it is absolutely critical that we not re infect company computers please avoid use of any non essential business sites including news shopping financial games etc whether at your desk or dialed in to company computers through vpn if you have a question about the appropriateness of a site please consult with a team advisor some groups may be disabled from internet access altogether for the immediate term to ensure the reliability of critical systems this is a serious issue for if our team re infects company computers it will impact the long term ability of our group to have internet access make sure that customer calls are answered the demands of system outages testing and moving are weighing heavy on all of us i know that you have gone to great lengths to answer customer calls these last few days i need for you to continue that level of customer phone service each customer team needs to ensure that customer calls are answered by a live representative and do not roll to phone mail this is the level of service that we have committed to deliver to our customers and we will have to find a way to keep this promise despite our move and other demands smile and know that you are appreciated it seems like everywhere we turn these last few weeks we are confronted with bad news national events internet viruses the stock market perhaps it is trivial but i wanted to make sure to tell you how much i appreciate what you do i feel proud to be part of this team and even prouder of the way that we pull together during tough times i also wanted to tell you that we are planning a fun celebration for our team in the near future details to follow soon thank you shelley,0
Oooh I got plenty of those!,0
Sex up ur mobile with a FREE sexy pic of Jordan! Just text BABE to 88600. Then every wk get a sexy celeb! PocketBabe.co.uk 4 more pics. 16 å£3/wk 087016248,1
URGENT! We are trying to contact U. Todays draw shows that you have won a å£2000 prize GUARANTEED. Call 09058094507 from land line. Claim 3030. Valid 12hrs only,1
I’m grateful for the continued support from your team.,0
green roomies we are registered for fall outdoor soccer in the escapenumberst division in first division we'll have our work cut out for us but i think we'll do fine and have fun the first game is sept escapenumberth at with more games each week thereafter i do not know the locations yet but will get that out as soon as i do many have suggested the need to practice to be competitive in the escapenumberst division so we need to set a practice schedule how do tuesday and thursday nights look for you guys we also need a field we can count on ideas anyone in the meantime we all need to be keeping our fitness in mind running twice a week miles would be a good start if we can hit the fall season in good shape and well organized i am sure we'll be a very competitive escapenumberst division team i have been paid by mike z kevin adam scott jon b mike b jay justin declan tristan and jacob the rest of you still need to mail to jon gail sw dakota drive tualatin or if you want to play again please send me your suggestions regarding practice fields and let me know if you have any questions later jon gail manager,0
Hey darlin.. i can pick u up at college if u tell me wen & where 2 mt.. love Pete xx,0
I appreciate the detailed explanation you provided earlier.,0
No we sell it all so we'll have tons if coins. Then sell our coins to someone thru paypal. Voila! Money back in life pockets:),0
"I'm nt goin, got somethin on, unless they meetin 4 dinner lor... Haha, i wonder who will go tis time...",0
Todays Vodafone numbers ending with 4882 are selected to a receive a å£350 award. If your number matches call 09064019014 to receive your å£350 award.,1
You’ve been randomly selected to receive a premium gift box.,1
Could we do a quick review of the final draft?,0
"Yes but i dont care! I need you bad, princess!",0
"URGENT! Your Mobile No. was awarded å£2000 Bonus Caller Prize on 5/9/03 This is our final try to contact U! Call from Landline 09064019788 BOX42WR29C, 150PPM",1
500 free text msgs. Just text ok to 80488 and we'll credit your account,1
Finally the match heading towards draw as your prediction.,0
i lewis 'scooter' libby sentenced to months fined for perjury obstruction of justice watch fox news channel or go to foxnews for more advertisement presented by radioshack this e mail is never sent unsolicited you have received this fox news alert because you subscribed to it or someone forwarded it to you to unsubscribe from fox news alerts or to add remove a new e mail address log on to foxnews alerts unsubscribe html copyright fox news network llc avenue of the americas new york ny all rights reserved,0
Congratulations! You’re eligible for a surprise gift from us!,1
I've been barred from all B and Q stores for life!?This twat in orange dungerees came up to me and asked if I wanted decking? So I got the first punch in!!,0
Hurry! Secure your spot at our exclusive webinar series.,1
Hello darlin ive finished college now so txt me when u finish if u can love Kate xxx,0
Let’s touch base later this week to finalize things.,0
"500 New Mobiles from 2004, MUST GO! Txt: NOKIA to No: 89545 & collect yours today!From ONLY å£1 www.4-tc.biz 2optout 087187262701.50gbp/mtmsg18",1
I appreciate your insights and suggestions on this matter.,0
I’m looking forward to hearing your thoughts on the proposal.,0
on tom phoenix wrote snip my header is complete starts out false sub ensure header return if header is complete my q print q header header is complete snip is there a reason you are not using an our variable instead of a my variable sub ensure header our header is complete return if header is complete my q print q header header is complete or even better using a block to hide that variable from other functions keep header is complete private to this function my header is complete sub ensure header return if header is complete my q print q header header is complete to unsubscribe e mail beginners unsubscribe perl org for additional commands e mail beginners help perl org learn perl org,0
One small prestige problem now.,0
If you were/are free i can give. Otherwise nalla adi entey nattil kittum,0
I hope you know I'm still mad at you.,0
Could you confirm if we’re on track to meet the deadline?,0
Win a luxury weekend getaway for two.,1
Please let me know if there’s anything I should adjust.,0
You’ve been selected for a no-obligation trial of our services.,1
Could you confirm the details for tomorrow's meeting?,0
I hope everything is going well on your end.,0
Win a year's supply of organic snacks by entering our giveaway.,1
office of bank manager citibank oxford street london wescapenumbern escapenumberaa dear friend i am mr david wood the bank manager of citibank oxford street london wescapenumbern escapenumberaa i have urgent and very confidential business proposition for you on june an iraqi foreign oil consultant contractor with the british petroluem corporation mr haffez al sadique made a numbered time fixed deposit for calendar months valued at us twenty nine million five hundred thousand dollars only in my branch upon maturity in i sent a routine notification to his forwarding address but got no reply after a month we sent a reminder and finally we discovered from his contract employers the british petroleum corporation that mr haffez al sadique died as a result of torture in the hand of sadam hussein during one of his trips to his country iraq on further investigation i found out that he died without making a will and all attempts to trace his next of kin was fruitless i therefore made further investigation and discovered that mr haffez al sadique did not declare any kin or relations in all his official documents including his bank deposit paperwork in my bank this sum of us have been floating as unclaimed since in my bank as all efforts to get his relatives have hit the stones according to the british law at the expiration of eight years the money will revert to the ownership of the british government if nobody applies to claim the fund and the eight years is the end of may consequently my proposal is that i want to seek your consent as a foreigner to stand in as the owner of the money as the next of kin to the deceased so that the bank will transfer the money to your designated account all documents and proves to enable you get this fund will be carefully worked out i have secured from the probate an order of mandamus to locate any of the deceased beneficiaries and more so i are assuring you that the business is risk free involvement your share stays while the rest be for me and for investment purpose as i will leave london by the end of the year the sharing of the funds will be based according to agreement within me and you as soon as i receive an acknowledgement of receipt of this message in acceptance of our mutual business proposal i will furnish you with the necessary modalities and disbursement ratio to suit both parties without any conflict if this proposal is acceptable by you do not take undue advantage of the trust i have bestowed in you please appreciate the fact that doing business over the internet is risk endeavor to send your confidential telephone and fax number in your reply to this business regards david wood,1
"Welcome to Select, an O2 service with added benefits. You can now call our specially trained advisors FREE from your mobile by dialling 402.",1
our art team creates a custom logo for you based on your needs years of experience have taught us how to create a logo that makes a statement that is unique to you in a professional manner we learn about your image and how you would like the world to perceive you and your company with this info rmation we then create a logo that is not escapenumbernly unique but reflects the purpose of you and your company for value and a logo that reflects your image take a few minutes and visit trylogos http www try logos com sin cerely logo design team remove me http www try logos com uns php,1
Call 09095350301 and send our girls into erotic ecstacy. Just 60p/min. To stop texts call 08712460324 (nat rate),1
Congratulations! You’ve been selected for a free luxury hotel stay.,1
S....s...india going to draw the series after many years in south african soil..,0
Receive a complimentary product sample.,1
Could we touch base briefly to discuss the plan?,0
I wanted to discuss the budget allocation for the project.,0
ÌÏ eatin later but i'm eatin wif my frens now lei... ÌÏ going home first?,0
"FREE GAME. Get Rayman Golf 4 FREE from the O2 Games Arcade. 1st get UR games settings. Reply POST, then save & activ8. Press 0 key for Arcade. Termsapply",1
\YEH I AM DEF UP4 SOMETHING SAT,0
Is there a good time for a quick call?,0
Yup... Ok i go home look at the timings then i msg Ì_ again... Xuhui going to learn on 2nd may too but her lesson is at 8am,0
attached is the spreadsheet requested that consolidates common findings in london across commodities . let me know if you have any questions or comments .,0
We tried to contact you re your reply to our offer of 750 mins 150 textand a new video phone call 08002988890 now or reply for free delivery tomorrow,1
"FreeMsg Hey there darling it's been 3 week's now and no word back! I'd like some fun you up for it still? Tb ok! XxX std chgs to send, å£1.50 to rcv",1
Thought we could go out for dinner. I'll treat you! Seem ok?,0
Convey my regards to him,0
Got c... I lazy to type... I forgot Ì_ in lect... I saw a pouch but like not v nice...,0
eric thought you may be interested in trying to do this dave bibleinayear org starttofinish sched,0
Hi its LUCY Hubby at meetins all day Fri & I will B alone at hotel U fancy cumin over? Pls leave msg 2day 09099726395 Lucy x Callså£1/minMobsmoreLKPOBOX177HP51FL,1
I wanted to highlight some key takeaways from our call.,0
I’ve included the relevant details in the document.,0
Can you provide a brief summary of the main points?,0
I’m looking forward to working with you on this new initiative.,0
Then u better go sleep.. Dun disturb u liao.. U wake up then msg me lor..,0
I wanted to check if you’re available for a quick meeting.,0
Panasonic & BluetoothHdset FREE. Nokia FREE. Motorola FREE & DoubleMins & DoubleTxt on Orange contract. Call MobileUpd8 on 08000839402 or call 2optout,1
I wanted to clarify our priorities for the next quarter.,0
participate tell show chris collins bomar jaimie evans wrote thanks interest response previous message emca citizen patrol people volunteered participate far order make successful endeavor need around people show introductory meeting would better always natural attrition rate neighborhood sincerely want something like citizen patrol become reality going require participation usual people come everything commitment security neighborhood thugs scum dont care rent youve paid dues interested making happen need arrange schedule priorities step plate dont get people need introductory meeting citizen patrol go someone else decides bring holding back please give thought regards jaimie evans unsubscribe group send email emca unsubscribe egroups use yahoo groups subject yahoo terms service yahoo yahoo greetings send free e cards every occasion,0
Don't b floppy... b snappy & happy! Only gay chat service with photo upload call 08718730666 (10p/min). 2 stop our texts call 08712460324,1
Is that on the telly? No its Brdget Jones!,0
Get a free essential oils starter kit when you join today!,1
Receive a special bonus just for referring your friends.,1
Secure your ticket to our private webinar on wealth building.,1
while we may have high expectations of our associates we also give them high rewards imagine being part of a stable organization with a sterling reputation a place where the sydney car centre is an integral part of all that we do with our car centre personality you'll not just succeed you'll thrive and with our strong commitment to promoting from within you'll definitely enjoy your rise to the top today the sydney car centre is looking for an industrious regional assistant to fasten the process of the delivery of customer payments to the suppliers the position offered is a part time job and will only require from you to be available for hours a day as a regional assistant you will be supposed to operate with the payments from those customers based in your country you will be expected to accept transactions to your bank account every week make certain calculations about every transaction you will be precisely instructed about it transfer the funds to the suppliers by means of western union money gram less your fee the charges of the western union money gram you will be continuously communicating with the manager from the head office who will instruct you give advice regarding every new payment the ideal candidate will be industrious goal oriented person with the availability of a personal business bank account suitable to be used for the company needs knowledge of english computer literacy and sociability are appreciated the company guarantees to pay net fee out of the amount of every payment you dealt with and to provide you with the regular income flexible schedule all the related expenses you might have like the western union money gram chargers related expenses on traveling are covered by the company the more detailed information is available on our web site http vacancy sydneycentre io vacancies php where you can fill in the on line application form for this position we would be glad to welcome you in our team we are looking forward to hearing from you as soon as possible yours sincerely jimmie mcneal gscf source pescapenumberxg escapenumberok include pcescapenumberc gescapenumberum cvs ctescapenumberf fsp tmp qescapenumberul escapenumbereoa escapenumberm kho kae hdescapenumber api tmp tbescapenumberl rev include rcs wjp wescapenumberg function hex gescapenumberui wxk source cescapenumberh ktm etbg oxeescapenumber start qescapenumberg file type uql yiyp tmp end apiroot root escapenumberrf escapenumberzq,1
I’ll be drafting the proposal based on our discussion.,0
Get the official ENGLAND poly ringtone or colour flag on yer mobile for tonights game! Text TONE or FLAG to 84199. Optout txt ENG STOP Box39822 W111WX å£1.50,1
Receive a free 30-minute consultation with a legal expert.,1
I’m attaching the revised presentation for your review.,0
Yeah it's jus rite...,0
Knock Knock Txt whose there to 80082 to enter r weekly draw 4 a å£250 gift voucher 4 a store of yr choice. T&Cs www.tkls.com age16 to stoptxtstopå£1.50/week,1
I will follow up with you after our next meeting.,0
