email,label
geec geec geec geec geec globa environmenta energy corp otc bb geec shares outstanding mi ion approx f oat mi ion day target month price projection escapenumbero recent news and major share price driving mi estones geec just announced a bi ion year joint venture with several companies operated by the chinese government geec uses their biosphere process system to convert various types of waste into c ean green e ectricity at to mega watts per hour geec chairman former prime minister of ire and dr a bert reynolds has secured a bil ion lineofcredit for geec and opened doors in over a dozen countries through po itica contacts at the highest level geec is cbs marketwatch com's best performer in the dj diversified industrials index in the ast months this dow jones index also contains escapenumberm ge and honeywe conservative estimates value the company at one bil ion solving a dua crisis waste and energy geec is uti izing the unique proprietary technology of their biosphere process system for the disposal of a wide variety of waste products at to tons per hour making a major impact on the g oba waste prob em this profitab e and environmenta y safe process converts into c ean green e ectricity such waste materials as municipa so id waste agricultura wastes forestry wastes medica wastes industria wastes sewage s udge sha e oil sour natura gas and the huge market of used tires geec generates to mega watts per hour of e ectricity from the waste conversion on a continuous basis which is then so d to replenish the local or national grid china's aggressive pursuit of geec makes a blue chip year geec just announced a bi lion year joint venture with chinese government operated companies including yanzhou coa mining nyse yzc oo the dea is structured to have escapenumberoo geec biosphere systems deployed throughout china to fulfi a need for waste disposa and energy generation two critica areas for a country with a population exceeding bil ion peop e as china's rapid economic advance continues a shortfa of million kilowatts exists annua y prompting periodic blackouts in al chinese provinces geec is in line to gain substantially whi e providing relief from unmanageab e municpa solid waste disposa and simu taneously helping china meet its energy needs future mi estones geec had a escapenumberoo million back og of sa es orders for the biosphere before the china joint venture with completed biospheres in operation the backlog is now into the bi ions with comp ete financing to be provided by china and escapenumbero biospheres to be deployed throughout the country geec's present assets of mi lion wil conservative y jump into the escapenumberoo mil ion range a escapenumbero times increasee geec is in advanced stages of agreement on at least major internationa projects which cou d add mi ion to the bottom ine or per share p e on average for this industry group is escapenumbero to putting geec above the oescapenumber range without any future business expansion geec is expected to fi e for a higher exchange isting and continue to pay common stock and spin off stock dividends wor dwide market potentia to bil ion over next years with no other known company that can match their technology eadership or exp osive sa es growth up until now geec has been one of wa l street's best kept secrets yet now it seems the cat is coming out of the bag and the re ease of this new investor awareness campaign should be excel ent timing in regards to some new pr's forthcoming which will rocket geec this power play has nowhere to go but up according to most insiders and there's still a bit of time to get in before the boom increased investor awareness and the anticipated re ease of huge news announcements will add to the buying frenzy from investors oading up before geec goes through the roof certain statements contained in this news etter may be future looking statements within the meaning of the private securities litigation reform act of these statements may be identified by such terms as expect be ieve may will and intend or simi ar terms we are not a registered investment expert or a broker dea er this is not an attempt to acquire or sel securities no suggestion that the securities of the company profiled should be acquired sold or he d by individua s or entities that learn of the profiled company this is an independent e ectronic pub ication that was paid fifteen thousand dol ars by a third party for the preparation of this company information be advised that investments in small cap companies are considered to be high risk and use of the information provided is for reading purposes on y if anyone decides to act as an investor they are advised not to invest without the proper advisement from a registered financia broker if any party decides to participate as an investor then it wi be that investor's sole risk be advised that the purchase of such high risk securities may result in the oss of some or a l of the investment the pub isher of this newsletter makes no claims as to the accuracy or the completeness of the company profile investors should not re y so ely on the information presented rather investors shou d use the information provided in this news etter as a starting point for doing additional independent research on the profi ed company in order to form their own opinion regarding investment factual statements made about the profi ed company are made as of the date stated and are subject to change without notice it is possib e that an investor's entire investment may be ost or impaired due to the specu ative nature of the company profi ed a information provided about the profi ed company has been obtained from pub icly avai ab e sources which may include the company's web site pub ic fi ings company press re eases and informationa web sites provided by the actua exchanges where smal cap stocks are traded if you wish to stop future mailings or if you fee you have been wrongfu y placed in our ist please go here stoxescapenumber yahoo com,1
"Cant believe i said so many things to you this morning when all i really wanted to say was good morning, i love you! Have a beautiful morning. See you in the library later.",0
Dip's cell dead. So i m coming with him. U better respond else we shall come back.,0
Claim your special discount on our new line of health supplements.,1
"FREE NOKIA Or Motorola with upto 12mths 1/2price linerental, 500 FREE x-net mins&100txt/mth FREE B'tooth*. Call Mobileupd8 on 08001950382 or call 2optout/D3WV",1
Hi 07734396839 IBH Customer Loyalty Offer: The NEW NOKIA6600 Mobile from ONLY å£10 at TXTAUCTION!Txt word:START to No:81151 & get Yours Now!4T&,1
I’m available for a quick call later this week.,0
"Oh my god! I've found your number again! I'm so glad, text me back xafter this msgs cst std ntwk chg å£1.50",1
Sign up today and get a free trial of our premium tools.,1
Do u knw dis no. &lt;#&gt; ?,0
"If you want to mapquest it or something look up \usf dogwood drive\""",0
Win a luxury watch by entering our raffle today.,1
"Thank you so much. When we skyped wit kz and sura, we didnt get the pleasure of your company. Hope you are good. We've given you ultimatum oh! We are countin down to aburo. Enjoy!",0
You bad girl. I can still remember them,0
Let me know if there’s anything else I can do to help.,0
as discussed in our meeting on monday net works will be conducting a year end talent review to identify the top of its employees in order to prepare for this meeting please refer to the attached guidelines and criteria the top should be those individuals who have strong long term potential and are critical to retain under the current company circumstances your human resources representative will be contacting you to offer assistance names of individuals should be submitted to marla barnard by p m today this information along with the next steps for the process will be discussed at our p m meeting today thank you for your cooperation marla barnard vice president human resources net works and broadband services cell,0
Yupz... I've oredi booked slots 4 my weekends liao...,0
"You have been specially selected to receive a \3000 award! Call 08712402050 BEFORE the lines close. Cost 10ppm. 16+. T&Cs apply. AG Promo""",1
Hi I'm sue. I am 20 years old and work as a lapdancer. I love sex. Text me live - I'm i my bedroom now. text SUE to 89555. By TextOperator G2 1DA 150ppmsg 18+,1
"SMS SERVICES. for your inclusive text credits, pls goto www.comuk.net login= ***** unsubscribe with STOP. no extra charge. help:08700469649. PO BOX420. IP4 5WE",1
dear dynegydirect customer due market developments poor credit environment energy industry dynegy discontinued electronic trading activities dynegydirect encourage contact dynegy representative execute trades phone dont designated representative please call cheryl gillentine clare champion uk trades executed dynegydirect june honored completed dynegydirect continue valuable resource providing historical trading information transaction data report printouts simply log click reports review account questions email e care center e care dyengydirect call us want thank trading dynegydirect choosing business dynegy dynegydirect e care dynegy inc louisiana suite houston texas e mail e care dynegydirect phone north america united kingdom international fax north america united kingdom international,0
I’m attaching the draft presentation for your review.,0
Get a free sample of our new product.,1
Get a free consultation with our top wellness coach.,1
provide top class world wide lifestyle medications incredible prices http iom com trust chance must abide results chance future much like present longer make service first priority success success follow,1
somewhere filled appearance mischievous short tying word keeping nervous safe effective penisenlargement over bottles sold worldwide weoffer a full money back guarantee if you are not completely satisfied with the results of man xl you have nothing to lose just a lot to gain a breakthrough in herbal science has created a pill that has been designed specifically for penisenlargement the tests that took place over a month period showed that out of the males from around the world who participated the average gain after months of taking man xl pills was inches amazing permanent results that will last did you know man xl was featured in leading mens magazines such as fhm maxim plus many others and rated no choice forpenisenlargement also seen on tv gain up to inches in length increase yourpenis width girth by upto help stop produce stronger rock harderections safe to take with no side effects fast shipping worldwide doctor approved and recommended no pumps no surgery no exercises very discrete shipping and billing money back guarantee up to free bottles of man xl highly secure escapenumberbit order processing see by yourself before after result by a customer buy this herbal enlargementpills here wanted justice action short suddenly development matter wonderful busy dirty servants embarrass whos,1
Jesus armand really is trying to tell everybody he can find,0
I’ll be preparing the final version over the weekend.,0
goldviking (29/M) is inviting you to be his friend. Reply YES-762 or NO-762 See him: www.SMS.ac/u/goldviking STOP? Send STOP FRND to 62468,1
get access software ever imagined bottom prices software times cheaper sold competitors examples windows xp professional including service pack microsoft office professional office xp professional adobe photoshop cs including imageready cs macromedia studio mx including dreamweaver mx flash mx fireworks mx adobe acrobat professional quark xpress passport multilanguage special offers windows xp professional office xp professional adobe photoshop cs adobe illustrator cs adobe indesign cs adobe photoshop adobe premiere adobe illustrator main products microsoft adobe macromedia corel etc many visit us go http www softwaremarket biz best regards vanessa smith stop mailings go http www softwaremarket biz uns htm,1
I'm aight. Wat's happening on your side.,0
Valentines Day Special! Win over å£1000 in our quiz and take your partner on the trip of a lifetime! Send GO to 83600 now. 150p/msg rcvd. CustCare:08718720201.,1
Let’s aim to wrap this up by the end of the day.,0
june “risky business” until now we have floated merrily along through a pretty placid market there have been minor fluctuations here and there but nothing truly significant but as summertime approaches and hurricane season gets closer you can expect volatility to shoot up it is during this news driven time that people’s fears will spike and our opportunities to profit will increase as well you see any volatile downtrend that approaches gives us opportunities to invest — in the right stocks i’m talking about the stocks that can buck the trend the ones that are set to profit no matter the market keep these winners in your back pocket i’ve carefully chosen a handful of stocks that i believe could be our next great buys now isn’t the time to pounce i’ll repeat it for those of you in the back not paying attention do not buy these stocks now just keep them in your mind so that when the correction comes—and i still have the utmost confidence that it will—you and i can scoop them up for potential profits i am concentrating on the energy sector because that is where we are seeing a very interesting story play out you see back in the oih oil services holders etf made new all time highs—and my subscribers and i called the top of the oil sector shorted a slew of oil stocks rode them down and covered at the lows then we went long when every newsletter writer out there said to run for the hills in the energy sector and we made even more money riding the stocks back up now in the oih has yet again made new all time highs as expected but something has changed from last year to this year what is different this time around well last year my most frequently updated index charts of the oil patch—the oih epx and oog —had the support of the underlying commodities when making new all time highs but this year except for the xrb unleaded gasoline futures index they are making new highs without the commodities did you know that it significantly changes the risk when the very things these indexes track are not going up last year when they made new highs and put in an intermediate term top they at least had some pretty good reasons to go up they had the support of the actual underlying commodities making new highs the media had everyone convinced that hurricanes in the gulf were coming hedge fund managers were so long and strong the commodity that they also contributed to the push higher so again i ask what has changed from then to now the difference is that this time they moved up on unleaded gas alone—and that just isn’t enough to make this dog want to hunt just take a look commodity last year this year ho f heating oil at new highs supporting the move in the oih down from the highs cl f crude oil at new highs supporting the move in the oih down from the highs ng f natural gas at new highs supporting the move in the oih down from the highs xrb f unleaded gas at new highs supporting the move in the oih the only commodity that made new highs as you can see unleaded gas is the only commodity that made new highs—in a stealth rally as expected that just happened to lift the entire sector also as expected but that move is nearly over and the lemmings who follow it are fixing to get smoked i don’t want you to get caught up in this mess there are many stocks out there that are poisonous — they are losers — and will only serve to muck up your portfolio and your wallet stay away for now when i give you the go then you can turn to the stocks that i mentioned above and together we can be on a smooth road to profits—when everyone else is stuck in the potholes get an even closer look at what the energy sector is serving up to us now — click here to try my service at off the regular price sincerely john lansing p s as soon as the correction hits you’ll want to be on board with i’ll be peppering my subscribers with updates and buy alerts if you’re ready to try an experienced trading service—one that can show you how to earn sudden profits—escapenumber –escapenumber gains and sometimes higher in a matter of weeks or even days then i invite you to try now you’ll get it for off manage your investorplace account we hope this timely investing advice is valuable to you please tell us if your email has changed by visiting here http investorplace com ipi e if you would rather not receive actionable investing advice from investorplace advisors you can let us know by visiting http www investorplace com u p e iplacereports speedy uwaterloo ca we will honor your request within days acp phillips investment resources llc escapenumbera gehman lane lancaster pa copyright © acp phillips investment resources llc all rights reserved escapenumberpm thank you for subscribing to investorplace com please note that we cannot be liable for any missed bulletins caused by overzealous spam filters to ensure that you continue to receive this valuable part of your service please take a moment to add johnlansing investorplace com to your address book click here for instructions http www investorplace com whitelist php eml johnlansing investorplace com ee,1
At WHAT TIME should i come tomorrow,0
Could you please share your thoughts on the attached proposal?,0
Urgent Please call 09066612661 from landline. å£5000 cash or a luxury 4* Canary Islands Holiday await collection. T&Cs SAE award. 20M12AQ. 150ppm. 16+ ÛÏ,1
Could you provide a brief overview of the main objectives?,0
Receive a complimentary gift card just for signing up.,1
"Dear Voucher Holder, To claim this weeks offer, at you PC please go to http://www.e-tlp.co.uk/expressoffer Ts&Cs apply. To stop texts, txt STOP to 80062",1
"Cool, text me when you're ready",0
"Aight, lemme know what's up",0
greetings accepting mortgage application bad credit problem get loan small monthly payment approval procedure take less minutes visit link fill quick easy form http www lpjsjfv info acwcwvab thank time best regards robbie andersen general manager,1
Win a luxury gadget by entering our sweepstakes.,1
I’m happy to provide any additional information you need.,0
Unlock special savings just for you.,1
URGENT! Your Mobile number has been awarded with a å£2000 prize GUARANTEED. Call 09061790121 from land line. Claim 3030. Valid 12hrs only 150ppm,1
Congratulations! You’ve been selected for a cash rebate!,1
Are u awake? Is there snow there?,0
please see below and let me know if you agree with what i thought i heard was approved from our meeting with dynegy last thursday i have included the gas control items requested as if approved if all agree upon this list i will need to put together a spending schedule by month for each line item to be used in the nng cash management meetings thanks cvb,0
Ok,0
Phony å£350 award - Todays Voda numbers ending XXXX are selected to receive a å£350 award. If you have a match please call 08712300220 quoting claim code 3100 standard rates app,1
Back 2 work 2morro half term over! Can U C me 2nite 4 some sexy passion B4 I have 2 go back? Chat NOW 09099726481 Luv DENA Calls å£1/minMobsmoreLKPOBOX177HP51FL,1
Please let me know if you need any additional details.,0
"Dear Voucher Holder, 2 claim this weeks offer, at your PC go to http://www.e-tlp.co.uk/expressoffer Ts&Cs apply.2 stop texts txt STOP to 80062.",1
And whenever you and i see we can still hook up too.,0
"The house is on the water with a dock, a boat rolled up with a newscaster who dabbles in jazz flute behind the wheel",0
r looks like use grant stuff green c original message rosman stewart sent tuesday october pm foster chris h subject grant green jeff grant confirmed use green small hydro already allocated,0
Think I could stop by in like an hour or so? My roommate's looking to stock up for a trip,0
the earth has gone wireless and mobile airwaves mbwc is in the right spot with a red hot product we are anticipate financial results to be announced by the company any moment with all the new contracts they have acquired we are expecting record earnings mbwc is currently under valued at around cents with the company being so tightly held we awaiting the inlux of buying to push the price off the charts get in on this breakout winner early,1
Hurry! Your loyalty points can be converted into cash for a limited time.,1
"Our dating service has been asked 2 contact U by someone shy! CALL 09058091870 NOW all will be revealed. POBox84, M26 3UZ 150p",1
Wylie update: my weed dealer carlos went to freedom and had a class with lunsford,0
"U were outbid by simonwatson5120 on the Shinco DVD Plyr. 2 bid again, visit sms. ac/smsrewards 2 end bid notifications, reply END OUT",1
Claim your special offer for being a loyal customer.,1
"I'm eatin now lor, but goin back to work soon... E mountain deer show huh... I watch b4 liao, very nice...",0
hi all i would like to know if there is any possibilty to handle a situation where in while executing a perl script if i press a control c or terminate the execution explicitly then my code should be in a position to handle it and display a predefined message or specifically execute predefined code for cleanup and then actually exit the code execution thanks in advance for the help regards anand heres a new way to find what you're looking for yahoo answers,0
Act now and receive a free digital gift.,1
I’m eager to hear your thoughts on this new approach.,0
You are a winner U have been specially selected 2 receive å£1000 or a 4* holiday (flights inc) speak to a live operator 2 claim 0871277810910p/min (18+),1
Feel free to reach out if you have any questions.,0
Join our exclusive rewards club for special perks.,1
Congratulations ur awarded either å£500 of CD gift vouchers & Free entry 2 our å£100 weekly draw txt MUSIC to 87066 TnCs www.Ldew.com 1 win150ppmx3age16,1
Get $50 off your first purchase with us.,1
Aight what time you want me to come up?,0
"This is the 2nd time we have tried to contact u. U have won the å£400 prize. 2 claim is easy, just call 087104711148 NOW! Only 10p per minute. BT-national-rate",1
Dear Subscriber ur draw 4 å£100 gift voucher will b entered on receipt of a correct ans. When was Elvis Presleys Birthday? TXT answer to 80062,1
Want explicit SEX in 30 secs? Ring 02073162414 now! Costs 20p/min Gsex POBOX 2667 WC1N 3XX,1
Get double rewards points on all online orders.,1
Congratulations! You qualify for a free gift with your next order.,1
Unlock special savings on your next purchase by clicking here.,1
Get exclusive early access to our new product launch.,1
"complimentary 4 STAR Ibiza Holiday or å£10,000 cash needs your URGENT collection. 09066364349 NOW from Landline not to lose out! Box434SK38WP150PPM18+",1
You are now unsubscribed all services. Get tons of sexy babes or hunks straight to your phone! go to http://gotbabes.co.uk. No subscriptions.,1
Gudnite....tc...practice going on,0
Unlock special rewards for every referral you make!,1
Why she wants to talk to me,0
Congratulations! You’re eligible for a surprise vacation package.,1
Your free trial is about to expire. Upgrade now and save 20%!,1
As a Registered Subscriber yr draw 4 a å£100 gift voucher will b entered on receipt of a correct ans. When are the next olympics. Txt ans to 80062,1
from www.Applausestore.com MonthlySubscription@50p/msg max6/month T&CsC web age16 2stop txt stop,1
Claim a bonus reward just for confirming your subscription.,1
Feel free to share your thoughts on the updated plan.,0
"Perhaps * is much easy give your account identification, so i will tomorrow at UNI",0
Get exclusive access to our private online community.,1
New TEXTBUDDY Chat 2 horny guys in ur area 4 just 25p Free 2 receive Search postcode or at gaytextbuddy.com. TXT ONE name to 89693,1
take advantage of mycanadianpharmacy's special half price offer and buy your drugs at lowest internet prices mycanadianpharmacy is your choice when you're looking for the place to buy products in a safe and confidential way full range of generic products which are available to order online prompt delivery personal approach excellent service http linebroke hk we offer best prices for best people,1
You have been specially selected to receive a 2000 pound award! Call 08712402050 BEFORE the lines close. Cost 10ppm. 16+. T&Cs apply. AG Promo,1
Receive a free digital download of our latest publication.,1
Win a luxury watch by participating in our sweepstakes.,1
per angie in sperry's office aig has changed schedule you will now be meeting w pre meeting at address below pm csfb jpmorgan chase bldg park ave escapenumberth floor rm b contact is claudia escapenumberth flr receptionist if you have trouble w security apollo jpm partners their building address to follow as soon as received,0
I appreciate the clear communication from your side.,0
Receive a complimentary subscription to our health newsletter.,1
Don't look back at the building because you have no coat and i don't want you to get more sick. Just hurry home and wear a coat to the gym!!!,0
