email,label
july hi frank ermis com i'm local can we meet http grnspd kudossweeps nowcenter com gspd aspx id email frank ermis com maybe coffee or drinks possibly breakfast get in touch i'm waiting http grnspd kudossweeps nowcenter com gspd aspx id email frank ermis com copyright c imatchup com inc all rights reserved this is an advertisement if you have any questions or concerns you may write to us at imatchup com malenfant boulevard dieppe nb eescapenumbera if you choose to do that please print out a copy of this advertisement and include it with your request or you can follow this link and it will direct you to an email preference page where you will be able to manage and control future correspondence from imatchup com however this will not mean that you will stop receiving communications from the list owner who sent you this email if you wish to do that then you need to follow their instructions on how to unsubscribe http grnspd kudossweeps nowcenter com gspd aspx id email frank ermis com this message is a solicitation if you wish to opt out from further e mails please go here http grnspd kudossweeps nowcenter com settings gspdid setid email frank ermis com so you can also write to us at kudossweeps com opt out department van nuys blvd van nuys ca,1
Receive a free upgrade to first-class for your next flight.,1
Hard LIVE 121 chat just 60p/min. Choose your girl and connect LIVE. Call 09094646899 now! Cheap Chat UK's biggest live service. VU BCM1896WC1N3XX,1
Hey loverboy! I love you !! I had to tell ... I look at your picture and ache to feel you between my legs ... Fuck I want you ... I need you ... I crave you .,0
Are you unique enough? Find out from 30th August. www.areyouunique.co.uk,1
Wanna get laid 2nite? Want real Dogging locations sent direct to ur mobile? Join the UK's largest Dogging Network. Txt PARK to 69696 now! Nyt. ec2a. 3lp å£1.50/msg,1
"Oh... I was thkin of goin yogasana at 10 den no nd to go at 3 den can rush to parco 4 nb... Okie lor, u call me when ready...",0
reply to àì¹ì¿µ to mike swerzbin com subject ¢å¹«·á ¿õáøã¼çèàìº¥æ®¿¡ ±íçï¸¦ ¸ð½ê´ï´ù date wed feb x mailer microsoft outlook imo build mime version content type multipart alternative boundary x priority x msmail priority high content type text plain content transfer encoding quoted printable fb ba fescapenumber da ce bf ad bb fescapenumber fd bf fescapenumber fescapenumber da bf fe cc bf bd cf a,1
Unlock early access to our clearance items for members only.,1
hello wanted inform launched new website tell little bit brought beauty back hair harsh chemicals swimming exposure sun left hair dry damaged destroyed felt need product restore brilliance could find anything market natural effective young adulthood traveled swim athlete throughout europe gathered natural beauty remedies combined pure ingredients developed unique formulation became know today nana essence wanted share products others could benefit natural remedies found nana essence want try products regret http www nanaessence com thank taking time read letter appreciate business nana korolev http www nanaessence com sales nanaessence com tel,1
"Goodnight, sleep well da please take care pa. Please.",0
URGENT! We are trying to contact U. Todays draw shows that you have won a å£800 prize GUARANTEED. Call 09050003091 from land line. Claim C52. Valid 12hrs only,1
Congratulations! You’re eligible for a special discount on travel.,1
I’m grateful for the opportunity to be part of this effort.,0
Sorry i'm not free...,0
HMV BONUS SPECIAL 500 pounds of genuine HMV vouchers to be won. Just answer 4 easy questions. Play Now! Send HMV to 86688 More info:www.100percent-real.com,1
We confirm eating at esplanade?,0
how tall are you princess?,0
ÌÏ all write or wat..,0
I'm home. Ard wat time will u reach?,0
Act fast to secure a free upgrade on your account.,1
"House-Maid is the murderer, coz the man was murdered on &lt;#&gt; th January.. As public holiday all govt.instituitions are closed,including post office..",0
Just wanted to confirm the meeting location and time.,0
now that oi and gas has entered a ong term bull market our specia ty in pinpointing the hottest companies of the few remaining undervalued energy p ays has produced soaring returns montana oil and gas inc mogi to explore further opportunities in a berta canada a is an energy developer in canada's most highly coveted reservoirs with generating potential of mi lions per week symbol mogi price increased last three day rating how much it will up again the va ue of mogi's shares wil skyrocket price charts confirm oil prices are experiencing the strongest bul market in a generation natura gas prices have trip ed in the ast two years with mu tiple projects in high gear and the expanding production on reserves worth mu ti millions mogi is selling for ess than the va ue of its assets montana oi and gas specializes in using new techno ogy to turn unproductive oi and gas deposits into profitab e enterprises a ready shares in the oi and gas sector are rising faster than the overa market in fact four of dow jones' ten top performing industry sectors for the past year are energy related but it's in the mid sized explorers and developers ike montana oil mogi that the biggest gains are being made in the last months many of these stocks made trip e and even quadrup e returns vancouver march mogi president peter sanders would like to announce that a decision has been made to explore further opportunities in the a berta canada region where the company current y has interests in three projects the company has become aware of existing opportunities to partner in or acquire eases which may inc ude producing we s and or exp oratory programs which wi l strengthen montanas position with energy cash oriented investment banking grescapenumberups one of the most effective ways to acquire financia partners for drilling programs involves existing production of oil and or gas in these programs this wi l significantly lessens the risk for the investment group hence encouraging financia participation as wel as speeding up the process of commitment by the investment group the sy van ake project wil begin very short y the company and its partners have secured a dri ing rig and are on y waiting for a temporary road ban to be ifted the rig is current y sitting in red deer alberta a mere miles from sylvan lake the initial wel is a foot peskisko sand test that is prospective for oi and gas it is expected to take approximately escapenumbero to days to dri l and test the initial well each development wel has probable production of escapenumbero barrels of oi per day and escapenumbero mi ion cubic feet gas per day with reserves in excess of bi ion cubic feet gas and escapenumbero escapenumberoo barrels of oil there are four other pay zones that are prospective for gas the average we in the sy van lake fie d has produced escapenumbero barre s of oi per day with over one mi lion cubic feet of gas per day if successfu the company intends to dri up to more we ls on these land sections for more detai ed information on this project please see news re ease dated feb escapenumberth an announcement will be made immediate y upon the commencement of dri ling the company is also pleased to report that the tie in of its west lock project did start several days ago and it is anticitaped that this will be comp ete some time in the next coup e of days peter sanders notes  the comp etion and tie in of the west lock project has ran into numerous de ays however this we l wi be tied in and the company will be sel ing gas by next week thus generating cash flow for the company the company wi l update its shareho ders when it has heard from its partner in regards to completion wi l mogi explode higher as more and more investors become aware of the stock if you think so you may not want to wait until it is too late remember timing your trade is critica good luck and successfu trading information within this publication contains future looking statements within the meaning of section escapenumbera of the securities act of and section escapenumberb of the securities exchange act of any statements thatexpress or invo ve discussions with respect to predictions expectations beliefs p ans projections objectives goa s assumptions or futureevents or performance are not statements of historical fact and may be future looking statements future looking statements are based on expectations estimates and projections at the time the statements are made that invo ve a number of risks and uncertainties which could cause actual results or events to differ materially from those presently anticipated future looking statements in this action may be identified through the use of words such as projects foresee expects will anticipates estimates be ieves understands or that by statements indicating certain actions may could or might occur these future looking statements are based on information currently avai ab e and are subject to a number of risks uncertainties and other factors that cou d cause mogis actua resu ts performance prospects or opportunities to differ materia y from those expressed in or imp ied by these future looking statements as with many microcap stocks today's company has additional risk factors that raise doubt about its abi ity to continue as a going concern these risks uncertainties and other factors inc ude without limitation the company's growth expectations and ongoing funding requirements and specifical y the company's growth prospects with sca ab e customers other risks inc ude the company's limited operating history the company's history of operating losses consumers' acceptance the company's use of licensed technologies risk of increased competition the potential need for additional financing the conditions and terms of any financing that is consummated the imited trading market for the company's securities the possible vo atility of the company's stock price the concentration of ownership and the potential fluctuation in the company's operating results the publisher of this report does not represent that the information contained in this message states all material facts or does not omit a materia fact necessary to make the statements therein not mis eading a information provided within this report pertaining to investing stocks securities must be understood as information provided and not investment advice the pub isher of this newsletter advises al readers and subscribers to seek advice from a registered professional securities representative before deciding to trade in stocks featured within this report none of the material within this report shall be construed as any kind of investment advice or solicitation many of these companies are on the verge of bankruptcy you can ose all your money by investing in this stock the pub isher of this report is not a registered investment expert subscribers should not view information herein as egal tax accounting or investment advice any reference to past performance s of companies are specia ly se ected to be referenced based on the favorab e performance of these companies you wou d need perfect timing to achieve the resu ts in the examples given there can be no assurance of that happening remember as a ways past performance is not indicative of future resu ts and a thorough due di igence effort inc uding a review of a company's fi ings at sec gov or edgar on ine com when availab e should be comp eted prior to investing a factual information in this report was gathered from pub ic sources including but not limited to company websites and company press releases the publisher discloses the receipt of fifteen thousand dol ars from a third party not an officer director or affiliate shareholder ofthe company for the preparation of this online report be aware of aninherent conf ict of interest resu ting from such compensation due to the fact that this is a paid publication the pub isher of this report be ieves this information to be reliab e but can make no assurance as to its accuracy or comp eteness use of the materia within this report constitutes your acceptance of these terms if you wish to stop future mailings or if you feel you have been wrongfu ly placed in our membership please go here or send a blank e mai with no thanks in the subject to yahoo com,1
PRIVATE! Your 2003 Account Statement for 07808247860 shows 800 un-redeemed S. I. M. points. Call 08719899229 Identifier Code: 40411 Expires 06/11/04,1
Get a free upgrade to VIP seats for our upcoming concert.,1
Thanks for the great discussion in our last meeting.,0
click here to join for free now and receive $ 5 . 00 fast start bonus instantly ! ! click here now for details : http : / / tinyurl . com / 5 mhm 9 if you are truly interested in improving your financial circumstances or creating wealth for yourself and your family for generations to come you really need to take the time to go to this page and find out how you can turn your millionaire ' s dream into reality . http : / / tinyurl . com / 5 mhm 9 bhupinder singh proud futuremillions member,1
Tomarrow final hearing on my laptop case so i cant.,0
Congratulations! You've been chosen to receive a surprise gift card.,1
Claim your free credit score report now.,1
Get complimentary access to our private financial workshop.,1
"K I'll head out in a few mins, see you there",0
Want 2 get laid tonight? Want real Dogging locations sent direct 2 ur Mob? Join the UK's largest Dogging Network by txting MOAN to 69888Nyt. ec2a. 31p.msg@150p,1
Everybody had fun this evening. Miss you.,0
I appreciate the clear and concise updates you’ve been providing.,0
seize the opportunity anatrim the newest most attracting product for over weight people available as you could see on oprah can you retain all the cases when you appeal to yourself to do anything for being delivered from this terrible number of kilos luckily now no great sacrifice is required thanks to anatrim the ground breaking you can get naturally health life style and become really slimmer take a look at what people write escapenumberi had always led a first class life till a year ago a girl i was meeting with said to me i was portly and in need of being careful to my health life was never the same after that until i disclosed anatrim at once after getting rid of about kilogrames only thanx to anatrim my private life has come back much better than before even thank you for the tremendous stuff the top quality service keep on the good work steve burbon las vegas there escapenumbers nothing better than slipping into a bikini i haven escapenumbert been dressed in for many long years now i feel svelte steadfast and strong thanx in great part to anatrim lots of thank you lusia r texas check out anatrim and you'll join the world spread community of thousands of happy user who are getting pleasure out of the revolutionary results of anatrim just now less gorging insanity less pounds and more merriment in your life proceed right here to inspect our outdone anatrim dealings http www pliggant com,1
Happy new year. Hope you are having a good semester,0
Win a year's subscription to our online fitness classes.,1
Ok going to sleep. Hope i can meet her.,0
Congratulations! You’re eligible for a no-strings-attached cash bonus.,1
Shall I bring us a bottle of wine to keep us amused? Only joking! IÛ÷ll bring one anyway,0
Receive a free coaching session on career advancement.,1
Let me know if you have any updates on the current status.,0
"K, can I pick up another 8th when you're done?",0
URGENT This is our 2nd attempt to contact U. Your å£900 prize from YESTERDAY is still awaiting collection. To claim CALL NOW 09061702893,1
Receive a free essential oil sample with your next wellness order.,1
Get a free credit report and find out if you qualify for a new credit line.,1
Thats cool. i liked your photos. You are very sexy!,0
FreeMsg Today's the day if you are ready! I'm horny & live in your town. I love sex fun & games! Netcollex Ltd 08700621170150p per msg reply Stop to end,1
"Congratulations! Thanks to a good friend U have WON the å£2,000 Xmas prize. 2 claim is easy, just call 08718726978 NOW! Only 10p per minute. BT-national-rate",1
Welp apparently he retired,0
Can U get 2 phone NOW? I wanna chat 2 set up meet Call me NOW on 09096102316 U can cum here 2moro Luv JANE xx Callså£1/minmoremobsEMSPOBox45PO139WA,1
UR GOING 2 BAHAMAS! CallFREEFONE 08081560665 and speak to a live operator to claim either Bahamas cruise ofå£2000 CASH 18+only. To opt out txt X to 07786200117,1
Get early access to our biggest sale of the year!,1
Act now to redeem your exclusive 25% discount code.,1
What time is ur flight tmr?,0
"K, wait chikku..il send aftr &lt;#&gt; mins",0
Could you please share the final list of requirements?,0
sports fans - get the latest sports news str* 2 ur mobile 1 wk FREE PLUS a FREE TONE Txt SPORT ON to 8007 www.getzed.co.uk 0870141701216+ norm 4txt/120p,1
Ok no prob. Take ur time.,0
I’ll be in touch once I have more updates.,0
18 days to Euro2004 kickoff! U will be kept informed of all the latest news and results daily. Unsubscribe send GET EURO STOP to 83222.,1
Neva mind it's ok..,0
Get a free gift card when you refer a friend.,1
tracy i do not think this is truly critical enough for wasaff we just need to get it teed up for payment then on its way to colorado bob chandler or carolyn do you know if this has moved forward from hayslett's okay original message from geaccone tracy sent friday february am to saunders james rittgers dan centilli carolyn cc russo gavin chandler bob cobb jr john zahn gary kilmer iii robert lokey teb hayslett rod subject re transwestern pipeline payment under protest confirmed payment by mail only has this been input into sap or do we need to go to wasaff on this original message from saunders james sent thursday february pm to rittgers dan centilli carolyn cc russo gavin chandler bob cobb jr john zahn gary kilmer iii robert lokey teb hayslett rod geaccone tracy subject re transwestern pipeline payment under protest confirmed payment by mail only it was approved today it won't get paid tomorrow original message from rittgers dan sent thursday february pm to centilli carolyn cc russo gavin chandler bob cobb jr john zahn gary kilmer iii robert lokey teb saunders james hayslett rod geaccone tracy subject re transwestern pipeline payment under protest confirmed payment by mail only due date is tomorrow asap please call me at ext or sandy rodriquez ext for pick up and mailing below is the mailing address for the subject c o dee malonson colorado department of revenue room sherman st denver co dan rittgers original message from saunders james sent thursday february am to hayslett rod geaccone tracy cc rittgers dan russo gavin chandler bob cobb jr john zahn gary kilmer iii robert lokey teb subject fw transwestern pipeline payment under protest confirmed payment by mail only rod and tracy as a result of a state of colorado audit tw has been assessed tax penalties and interest for compressor fuel use escapenumbermm and on the purchase of a la plata facility escapenumbermm we are protesting however it has been recommended and i concur that we pay the compressor fuel use assessment under protest to stop interest accruals on the use tax assessment we believe the sales tax assessment is at best weak and therefore do not recommend any payment we're requesting approval to cut a check to the colorado dept of revenue for this payment would be a deferred expense until the protest is fully resolved original message from rittgers dan sent wednesday february pm to saunders james cc chandler bob zahn gary russo gavin subject transwestern pipeline payment under protest confirmed payment by mail only thank you for your time today i have confirmed that the payment under protest amount is calculated as follows transwestern pipeline colorado sales use tax payment under protest compressor fuel for period september to july consumer use county sales total normal tax normal interest less discount payment due confirmed with d malonson at check reference description should include colorado notice number colorado account l compressor fuel we would like to include check number in our transmittal when known we do not have to pay the million for the purchase of the compressor station dan rittgers,0
Dunno da next show aft 6 is 850. Toa payoh got 650.,0
"Are you being good, baby? :)",0
Then mum's repent how?,0
bert gunter wrote frank et al i believe this is a bit too facile cfr part does necessitate a software validation process but this process does not require any for database software and for medical devices particular software rather it requires that those using whatever software demonstrate to the fda's satisfaction that the software does what it's supposed to do appropriately this includes a lot more than assuring say the numerical accuracy of computations i think it also requires demonstration that the data are secure that it is properly transferred from one source to another etc i assume that the statistical validation of r would be relatively simple as r already has an extensive test suite and it would simply be a matter of providing that test suite info a bit more might be required but i don't think it's such a big deal i think wensui liu's characterization of clinical statisticians as having a mentality related to job security is a canard although i work in nonclinical my observation is that clinical statistics is complex and difficult not only because of many challenging statistical issues but also because of the labyrinthian complexities of the regulated and extremely costly environment in which they work it is certainly a job that i could not do that said probably the greatest obstacle to change from sas is neither obstinacy nor ignorance but rather inertia pharmaceutical companies have over the decades made a huge investment in sas infrastructure to support the collection organization analysis and submission of data for clinical trials to convert this to anything else would be a herculean task involving huge expense risk and resources r s plus and much else e g numerous unvalidated data mining software packages are routinely used by clinical statisticians to better understand their data and for exploratory analyses that are used to supplement official analyses e g for trying to justify collection of tissue samples or a pivotal study in a patient subpopulation but it is difficult for me to see how one could make a business case to change clinical trial analysis software infrastructure from sas to s plus spss or anything else what i would love to have is some efficiency estimates for sas macro programming as done in pharma vs using a high level language my bias is that sas macro programming which costs companies more than sas licenses is incredibly inefficient frank disclainmer my opinions only they do not in any way represent the view of my company or its employees bert gunter genentech nonclinical statistics south san francisco ca original message from r help bounces stat math ethz ch mailto r help bounces stat math ethz ch on behalf of frank e harrell jr sent friday june am to giovanni parrinello cc r help stat math ethz ch subject re r r is not a validated software package giovanni parrinello wrote dear all discussing with a statistician of a pharmaceutical company i received this answer about the statistical package that i have planned to use as r is not a validated software package we would like to ask if it would rather be possible for you to use sas spss or another approved statistical software system could someone suggest me a 'polite' answer tia giovanni search the archives and you'll find a lot of responses briefly in my view there are no requirements just some pharma companies that think there are fda is required to accepted all submissions and they get some where only excel was used or minitab and lots more there is a session on this at the upcoming r international users meeting in iowa in august the session will include dicussions of federal regulation compliance for r for those users who feel that such compliance is actually needed frank frank e harrell jr professor and chair school of medicine department of biostatistics vanderbilt university r help stat math ethz ch mailing list https stat ethz ch listinfo r help please do read the posting guide r project org posting guide html and provide commented minimal self contained reproducible code,0
"i just wanted to say congratulations on your recent promotion . in case you are wondering who i am , i work in the global contracts groups under linda bryan as staff - deal compliance . its always good to see someone who is on your same team succeeding . much success in your future at . best regards , bridgette anderson",0
ffffffbe ffffffcescapenumber ffffffcescapenumber ffffffcc ffffffcescapenumber ffffffcescapenumber,1
I think chennai well settled?,0
;-) ok. I feel like john lennon.,0
ÌÏ mean it's confirmed... I tot they juz say oni... Ok then...,0
vjzzwoooa ca mxaxl fbloxszxty jaqvugijsx,1
Act fast! Get a $200 rebate on your next insurance payment.,1
Please find the updated timeline attached.,0
