email,label
chris why are they removing language that let's us confer with gulf's project management and subcontractors what's to hide remember lack of such information is what led us to this escapenumberth hour problem to begin with reference the information i passed along yesterday these folks do not appear to be familiar with what it takes to manage a fast track project they don't monitor subcontractors performance on a real time basis and or in great enough detail to understand what is really going on and in order to avoid problems rather than find creative ways to manage them it's a black box mentality to construction management and it's risky as i recall their attorney said something like we mange things differently than you might and that's just the way it is sorry if you don't like our style while he was referring to right of way acquisition at that moment i can assure you that their project managers howell sims powell have the same attitude we need to audit construction progress in detail because they will not why don't they want to show us expediting costs we're still liable for all incremental costs if someone other than gulf gets supply jurisdiction right seems to me we're still protecting our interests which haven't been protected very well to date see above how can we not be concerned with our exposure to potential incremental costs if we think it is highly unlikely that anyone other than gulf will prevail in the jurisdictional dispute then maybe we could agree to this in any case without detailed cost tracking we are creating an incremental cost time bomb the only question is whether the regulatory legal processes will set it off pardon the insensitive analogy we need access to the information as requested in order to protected our interests regardless of who is paying to get this project back on track if we can only get one of the items i listed it needs to be direct access to the subcontractors we may not know the costs but we will at least able to make sure construction progress is acceptable and have a feel for construction related risks if we need to give up something to get the agreement signed give up interaction with gulf power project team and or all gulf power project reporting it is very difficult to get a meeting or conference with them anyway their project tracking and reporting are practically non existent and have no substantial value otherwise we wouldn't be in our current predicament not sure if this constitutes comments or a short speech but i hope it helps dave original message from hilgert chris sent tuesday november am to owen david subject fw construction expedition letter dave comments please thanks chris original message from nemec gerald sent mon pm to 'bill katzlaw com' cc hilgert chris subject fw construction expedition letter per our discussion please review and provide comments asap original message from jeffrey stone sent monday november pm to nemec gerald cc hilgert chris mawhowel southernco subject construction expedition letter here are gulf's proposed changes to match the concept discussed earlier this afternoon original message from nemec gerald smtp gerald nemec sent wednesday november am to rab beggslane howell marion w cc hilgert chris owen david alexander james c subject construction expedition letter for your review is the draft construction expedition letter per our discussions monday this e mail is the property of corp and or its relevant affiliate and may contain confidential and privileged material for the sole use of the intended recipient s any review use distribution or disclosure by others is strictly prohibited if you are not the intended recipient or authorized to receive for the recipient please contact the sender or reply to corp at messaging administration and delete all copies of the message this e mail and any attachments hereto are not intended to be an offer or an acceptance and do not create or evidence a binding and enforceable contract between corp or any of its affiliates and the intended recipient or any other party and may not be relied on by anyone as the basis of a contract by estoppel or otherwise thank you file doc doc,0
Win a free gift card by joining our rewards program.,1
Men like shorter ladies. Gaze up into his eyes.,0
hello young fresh teens go f u c k n g wild small young little woman petite teens getting f u c k e exclusive models see free preview http alcoholism hoppik com,1
Could you review the attached agenda before the meeting?,0
hi to access element of a given date sat date inp from hofdates you can do the following my date inp die no etries for date date inp unless exists hofdates date inp and hofdates date inp foreach my hash ref hofdates date inp while my field value each hash ref print fieal field value value\\n hope that helps yaron kahanovitch original message from pauld to beginners perl org perl beginners moderators isc org sent gmt africa harare שבת מאי subject accesing a hash of an array of hashes ive read a load of data in from a csv file with text csv and ended up with a hash hash where the keys are the column labels my headings split rows and then for my j j rows j my status csv parse rows j parse a csv string into fields my columns csv fields get the parsed fields for my i i columns i hash headings i columns i i want to process the data once its grouped by the date field present in hash so i think i want a hash of dates where the key is that date field i push onto the value the hashes of the records that contain the date push hofdates hash date \\ hash but im having a problem working out how to access the individual items in the hashes that are elements of the array to unsubscribe e mail beginners unsubscribe perl org for additional commands e mail beginners help perl org learn perl org to unsubscribe e mail beginners unsubscribe perl org for additional commands e mail beginners help perl org learn perl org,0
Tell me again what your address is,0
"I'll text carlos and let you know, hang on",0
Could you provide an overview of the recent developments?,0
Claim your free year of online streaming service.,1
FREE entry into our å£250 weekly competition just text the word WIN to 80086 NOW. 18 T&C www.txttowin.co.uk,1
"Someone U know has asked our dating service 2 contact you! Cant guess who? CALL 09058095107 NOW all will be revealed. POBox 7, S3XY 150p",1
Wanna have a laugh? Try CHIT-CHAT on your mobile now! Logon by txting the word: CHAT and send it to No: 8883 CM PO Box 4217 London W1A 6ZF 16+ 118p/msg rcvd,1
new ticket created by steve peters please include the string perl in the subject line of all future correspondence about this issue creating new instance variables after a new is never good the attached patch is needed before things can start to be moved around steve peters steve fisharerojo org index lib parrot opsescapenumberc utils pm lib parrot opsescapenumberc utils pm revision lib parrot opsescapenumberc utils pm working copy argsref preamble preamble argsref init func init func argsref bs argsref base argsref suffix argsref opsarraytype argsref trans opsarraytype argsref flag flagref return bless argsref class sub print c source top my self shift self defines self trans defines invoked as defines self bs self base self suffix also invoked as bs self opsarraytype self trans opsarraytype begin printing to source open my source ' ' self source,0
hey i just found an super deal for you to put your website promotion on autopilot you wont have to worry about it ever again here's all the details www website needs traffic com every site needs a massive marketing program in order to be a success the most essential part of any campaign is traffic and sales its easy to get exposure to hundreds of thousands every month imagine your traffic and sales problem solved forever what will you do with all the extra time on your hands spots in this program are limited so hurry on over www website needs traffic com no more www website needs traffic com opts html phosphorescent dietetic combination tempo centric debase vague screenplay downwind chemistry wilcox corpora despot precocious acetylene deallocate explosive hilarious selectric thumbnail incipient gravy collegian pappas commercial observation serology butterfly ferdinand barbour compete rhetorician mesmeric flow baritone lulu broadway belvidere cautionary cartesian fascism contextual atavism apollo stanza implantation gallery houghton baptist attach mountain derange erickson harmonious tear gaberones ashland midshipmen concoct lustful importation moscow broadside almagest candlewick wyandotte bait convict circumlocution debugging transpond stile coup hedgehog colossus hospital eligible dynastic inventive eat,1
jenl inphi bqixp haakdw,1
Get a complimentary upgrade when you purchase now.,1
I’ll keep you posted on any new updates.,0
important information 4 orange user . today is your lucky day!2find out why log onto http://www.urawinner.com THERE'S A FANTASTIC SURPRISE AWAITING YOU!,1
"Wow ... I love you sooo much, you know ? I can barely stand it ! I wonder how your day goes and if you are well, my love ... I think of you and miss you",0
Receive a special gift just for being a loyal customer.,1
I’m open to suggestions for improving our approach.,0
I’m grateful for your assistance in resolving this matter.,0
Let me know if we need to make any adjustments.,0
Congratulations! You’re a lucky winner of a cash prize!,1
Its ok my arm is feeling weak cuz i got a shot so we can go another time,0
HI DARLIN IVE JUST GOT BACK AND I HAD A REALLY NICE NIGHT AND THANKS SO MUCH FOR THE LIFT SEE U TOMORROW XXX,0
Dear U've been invited to XCHAT. This is our final attempt to contact u! Txt CHAT to 86688 150p/MsgrcvdHG/Suite342/2Lands/Row/W1J6HL LDN 18 yrs,1
"I want some cock! My hubby's away, I need a real man 2 satisfy me. Txt WIFE to 89938 for no strings action. (Txt STOP 2 end, txt rec å£1.50ea. OTBox 731 LA1 7WS. )",1
"hello , we would like to offer localized software versions ( german , french , spanish , uk , and many others ) . ali iisted software is availabie for immediate download ! no need to wait 2 - 3 week for cd deiivery ! just few examples : - norton internet security pro 2005 - $ 29 . 95 - windows xp professional with sp 2 full version - $ 59 . 95 - corel draw graphics suite 12 - $ 49 . 95 - dreamweaver mx 2004 ( homesite 5 . 5 includinq ) - $ 39 . 95 - macromedia studio mx 2004 - $ 119 . 95 just browse our site and find any software you need in your native languaqe ! best regards , kristine",1
SMS. ac Sptv: The New Jersey Devils and the Detroit Red Wings play Ice Hockey. Correct or Incorrect? End? Reply END SPTV,1
Get a free consultation with a top financial advisor.,1
"hello bait - passover , n ' v , r ion marketing limitedd 2 , 23 , borrett road , mid - levels westhong kong lessen nee dutch abalone atone ivy pixel tyranny accumulate communicable meager boxcar compelled friedrich whirlpool lymphocyte archenemy dilatory kayo conklin bolton handwaving diagonal injure convergent colorate alcott",1
I’ll send out the meeting agenda later this afternoon.,0
100 dating service cal;l 09064012103 box334sk38ch,1
thanks for the reply actually when i tried installing only module my test was failing later i figure out its because of the version module that i have installed in my system thats why i was trying to uninstall the module and see how only module react thank you all for your help oryannescapenumber wrote a aryaescapenumber wrote hello does anyone know what is the most effective way of uninstalling perl module thank you why would you want to do such a thing just take the path to this module out of inc by editing your profile and or perlescapenumberlib variable unless you think its corrupt perl le 'print join \\n inc ' if you really want to remove this module do a backup first tar cvf module tar path to module then rm rf path to module here is a script to see what is installed show me all installed modules use file find 'find' use file spec functions my i print your installed modules on o are \\n print x \\n find wanted sub print i \\t \\n if \\ pm\\z no chdir inc hope that helps be a better globetrotter get better travel answers from someone who knows yahoo answers check it out answers yahoo dir link list sid to unsubscribe e mail beginners unsubscribe perl org for additional commands e mail beginners help perl org learn perl org need a vacation get great deals to amazing places on yahoo travel travel yahoo to unsubscribe e mail beginners unsubscribe perl org for additional commands e mail beginners help perl org learn perl org,0
You will recieve your tone within the next 24hrs. For Terms and conditions please see Channel U Teletext Pg 750,1
"here is my list . i also touched base with brent , bob , and leslie to see who they wanted to include from their staff as well . we ' re a little over the suggested max of 25 people . i ' ve made a call to lisa petruska to see if 25 is a firm number or if we can go a little over . please review and make and additions / deletions you see fit and then return . i will send out the notice to get this on everyone ' s calendar once i have your updates . i suggest we let each department handle flight arrangements , but that we centrally coordinate lodging .",0
I’m grateful for the chance to contribute to this project.,0
Thanks for your assistance in organizing the event.,0
Thank you for the great discussion earlier today.,0
Ok. Every night take a warm bath drink a cup of milk and you'll see a work of magic. You still need to loose weight. Just so that you know,0
I’ll be drafting the agenda for our next meeting.,0
"for customers prefer quality goods , our lnk - shoppe is a great choice for quality lnk goods and total convenience . , please select reliable - site _ for quality ones from apple , brother , canon , compaq , hp , lexmark , nec and many others . check the best choice for quality lnk goods and choose top value . absolutely great rebates and services experience quick handling that takes less than 72 hours - - - - - original message - - - - - from : booker @ wbtr . com [ mailto : austin @ odo . com ] sent : thursday , march 4 , 2005 8 : 76 pm to : trevor ; carey @ n . com ; ; austin ; jaime subject : nice pick for professional support and quick response it is professional client support provided by cyber - site _ . intoeternal life . in the churchyard where the walls were surrounded with sandc then look ed at the sky on which the rosy dawn grew brighter and brighter ; then she gl have stroked thewild horses , and shaken the cocoa - n washing the clothes down by the river , and you aregoiuts from the trees . yes , i haveman ng to carry that thing to her here 5 in that you have in your pocket . it isvery bad for your mother . how much have you got 7 othing voices lara lay buried . jurgen did not seem to know this ; it did not enterhis mind , which could onl",1
"hi . ! . better quality , better prices , better choice ! viagra for only 64 $ cialis only for 96 $ vicodin only for 310 $ valium today costs 70 $ xanax only for 75 $ ambien costs only 68 $ paxil only for 70 $ prozac only for 70 $ zoloft costs only 70 $ lipitor costs only 70 $ glucophage for only 60 $ levitra for only 85 $ propecia only for 72 $ celebrex only for 72 $ soma costs only 65 $ vioxx for only 70 $ zyban costs only 80 $ meridia only for 75 $ xenical only for 70 $ find info on the products here : http : / / . com / ? a = 510",1
"Win the newest åÒHarry Potter and the Order of the Phoenix (Book 5) reply HARRY, answer 5 questions - chance to be the first among readers!",1
Save money on wedding lingerie at www.bridal.petticoatdreams.co.uk Choose from a superb selection with national delivery. Brought to you by WeddingFriend,1
dear ebay seller you've been on a super sales streak and since you've done so well it's time to recognize you for your efforts you are powerseller silver congratulations joining the ebay silver powerseller program come and join us when you join the powerseller program you the support you'll need for continued success so why wait join now powerseller icon next to your user id in recognition of your hard work powerseller priority support via email webform and phone support at silver level and above exclusive offerings on the powerseller portal check in frequently to see updated program benefits and special offers discussion board for you to network with other powersellers free powerseller business templates for business cards and letterhead membership to the powerseller program is free again congratulations and best wishes for your contin success regards ebay powerseller team if you agree with this rank please become an ebay power seller within hours copyright © ebay inc all rights reserved designated trademarks and brands are the property of their respective owners use of this web site constitutes acceptance of the ebay user agreement and privacy policy,1
You won't believe it but it's true. It's Incredible Txts! Reply G now to learn truly amazing things that will blow your mind. From O2FWD only 18p/txt,1
"'An Amazing Quote'' - \Sometimes in life its difficult to decide whats wrong!! a lie that brings a smile or the truth that brings a tear....\""""",0
while we may have high expectations of our associates we also give them high rewards imagine being part of a stable organization with a sterling reputation a place where the sydney car centre is an integral part of all that we do with our car centre personality you'll not just succeed you'll thrive and with our strong commitment to promoting from within you'll definitely enjoy your rise to the top today the sydney car centre is looking for an industrious regional assistant to fasten the process of the delivery of customer payments to the suppliers the position offered is a part time job and will only require from you to be available for hours a day as a regional assistant you will be supposed to operate with the payments from those customers based in your country you will be expected to accept transactions to your bank account every week make certain calculations about every transaction you will be precisely instructed about it transfer the funds to the suppliers by means of western union money gram less your fee the charges of the western union money gram you will be continuously communicating with the manager from the head office who will instruct you give advice regarding every new payment the ideal candidate will be industrious goal oriented person with the availability of a personal business bank account suitable to be used for the company needs knowledge of english computer literacy and sociability are appreciated the company guarantees to pay net fee out of the amount of every payment you dealt with and to provide you with the regular income flexible schedule all the related expenses you might have like the western union money gram chargers related expenses on traveling are covered by the company the more detailed information is available on our web site http vacancy centrecar vg vacancies php where you can fill in the on line application form for this position we would be glad to welcome you in our team we are looking forward to hearing from you as soon as possible yours sincerely lillie post mwv escapenumbermb hsf media function uescapenumberma close bescapenumbery lewo file escapenumberuk start bosq cmescapenumber engine media aklv close uwg create escapenumbervt nescapenumberx jvescapenumber root source kaescapenumber create dec close define update gam cjer oro,1
2p per min to call Germany 08448350055 from your BT line. Just 2p per min. Check PlanetTalkInstant.com for info & T's & C's. Text stop to opt out,1
Free Top ringtone -sub to weekly ringtone-get 1st week free-send SUBPOLY to 81618-?3 per week-stop sms-08718727870,1
Also where's the piece,0
Yes. Last practice,0
Claim a limited-time offer on our top products.,1
Eh sorry leh... I din c ur msg. Not sad already lar. Me watching tv now. U still in office?,0
christmas sale vicodin drugs find better prices anywhere v icodin piils v iagra pilis c ialis piils mbien pilis x anax piils many please click check offer http stack wowhealth info php aid grandchild wy inhomogeneous emittance angel nco plaintiff midwives sample campfire accountant ywca carbohydrate meadow lockheed dunce bucket fiscal radcliffe countryside bumble dubitable trough delectable befoul fanatic biracial jo lifelong change involutory aboveboard coralberry miff glue implausible raspberry apropos renault plumage rejecter alveoli reprehensible araby three shovel zilch forcible barrage baptism cheesecloth improve egalitarian compacter,1
hxpn is gaining great momentum we are about to see firworks watch it on monday may company harris exploration inc symbol hxpn price day target rating agressive buy hxpn has gained over in days we are expecting gains topping and more get in now while you still can make profit indeed harriet it would have been a severe pang to lose you but it oh what a sweet house how very beautiful there are the yellow cu there was merit in every drawing in the least finished perhaps the m when miss smiths and mr eltons get acquainted they do indeed and r your father will not be easy why do not you go how much his business engrosses him already is very plain from the ci be satisfied said he i will not raise any outcry i will keep my it was weather which might fairly confine every body at home and thou very well replied emma a most natural feeling and the longer it harriet exactly soft is the very word for her eye of all epithets t this she had been prepared for when she entered the house but meant,1
"SPJanuary Male Sale! Hot Gay chat now cheaper, call 08709222922. National rate from 1.5p/min cheap to 7.8p/min peak! To stop texts call 08712460324 (10p/min)",1
I’m looking forward to reviewing your updated draft.,0
stephanie please add the following individuals set forth below to list of recipients to receive the master termination log also please add steve hall to that list thanks susan original message from rosman stewart sent wednesday december am to bailey susan subject people on termination list sean crandall diana scholtes jeff richter chris mallory mark fischer tom alonso,0
Ok. There may be a free gym about.,0
"Double mins and txts 4 6months FREE Bluetooth on Orange. Available on Sony, Nokia Motorola phones. Call MobileUpd8 on 08000839402 or call2optout/N9DX",1
We can go 4 e normal pilates after our intro...,0
Receive a complimentary accessory with your next purchase.,1
"Orange customer, you may now claim your FREE CAMERA PHONE upgrade for your loyalty. Call now on 0207 153 9996. Offer ends 14thMarch. T&C's apply. Opt-out availa",1
adschai optonline net wrote hi i am new to these functions i'm wondering if there is anyway to save the entire results all attributes of the result object from the chisq test or mantelhaen test functions for example from chisq test function you will have statistic parameter p value expected etc in the result list how can i save all of them in one shot to says a text file or csv file thank you adschai you could unlist the result coerce it to a data frame then use write table for example something like this write table as data frame t unlist chisq test insectsprays count insectsprays spray quote false or write table as data frame unlist chisq test insectsprays count insectsprays spray quote false r help stat math ethz ch mailing list https stat ethz ch listinfo r help please do read the posting guide r project org posting guide html and provide commented minimal self contained reproducible code chuck cleland ph d ndri inc west escapenumberrd street escapenumberth floor new york ny tel tu th tel m w f fax r help stat math ethz ch mailing list https stat ethz ch listinfo r help please do read the posting guide r project org posting guide html and provide commented minimal self contained reproducible code,0
Congratulations! You’ve been awarded a premium membership for free.,1
I wanted to share some best practices we’ve identified.,0
K.i did't see you.:)k:)where are you now?,0
I'm in class. Did you get my text.,0
Please find the attached document for your review.,0
"Watching cartoon, listening music &amp; at eve had to go temple &amp; church.. What about u?",0
"anthony duenner @ _ development on 12 / 15 / 99 01 : 46 : 35 pm to : mark ruane @ ect , zimin lu @ ect cc : subject : presentation in seoul better late than never - - i again wanted to thank both of you for taking the time and making the effort to make the raroc and real options presentations in seoul earlier this month . both presentations were well received and i had a number of favorable comments and expressions of thanks form our hosts after the presentations . i know you both have very busy schedules - - especially around this time of year - - and very much appreciate your help . regards . anthony duenner",0
